{"collision":null,"default_grounding":"FOLLOW_TERRAIN","footprint_radius_m":"1.1","height_offset_range_m":["-0.1","0.5"],"material_slots":[{"role":"surface","slot_id":"body","surfaces":{"godot_static_source_v1":[{"node_path":"Body","surface":0}],"portable_glb_v1":[{"mesh":0,"primitive":0}]}}],"placement_anchor":["0.25","0","-0.5"],"preview_warnings":[],"scale_range":["0.5","2"],"schema_version":1}